{
    "$schema": "http://json-schema.org/draft-07/schema#",
    "type": "object",
    "properties": {
        "name" : {
            "type": "string"
        },
        "comment" : {
            "type": "string"
        },
        "initialState": {
            "type": "object",
            "properties": {
                "shells": {
                    "type": "array",
                    "items": {
                        "$ref": "https://api.swaggerhub.com/domains/Plattform_i40/Part1-MetaModel-Schemas/V3.0.1#/components/schemas/AssetAdministrationShell"
                    }
                },
                "submodels": {
                    "type": "array",
                    "items": {
                        "$ref": "https://api.swaggerhub.com/domains/Plattform_i40/Part1-MetaModel-Schemas/V3.0.1#/components/schemas/Submodel"
                    }
                },
                "shellDescriptors": {
                    "type": "object",
                    "additionalProperties": {
                        "$ref": "https://api.swaggerhub.com/domains/Plattform_i40/Part2-API-Schemas/V3.0.1#/components/schemas/AssetAdministrationShellDescriptor"
                    }
                },
                "submodelDescriptors": {
                    "type": "object",
                    "additionalProperties": {
                        "$ref": "https://api.swaggerhub.com/domains/Plattform_i40/Part2-API-Schemas/V3.0.1#/components/schemas/SubmodelDescriptor"
                    }
                }
            }
        },
        "invocation": {
            "type": "object",
            "properties": {
                "args": {
                    "type": "object"
                }
            },
            "required": ["args"]
        },
        "expectedState": {
            "type": "object",
            "properties": {
                "shells": {
                    "type": "array",
                    "items": {
                        "$ref": "https://api.swaggerhub.com/domains/Plattform_i40/Part1-MetaModel-Schemas/V3.0.1#/components/schemas/AssetAdministrationShell"
                    }
                },
                "submodels": {
                    "type": "array",
                    "items": {
                        "$ref": "https://api.swaggerhub.com/domains/Plattform_i40/Part1-MetaModel-Schemas/V3.0.1#/components/schemas/Submodel"
                    }
                },
                "shellDescriptors": {
                    "type": "object",
                    "additionalProperties": {
                        "$ref": "https://api.swaggerhub.com/domains/Plattform_i40/Part2-API-Schemas/V3.0.1#/components/schemas/AssetAdministrationShellDescriptor"
                    }
                },
                "submodelDescriptors": {
                    "type": "object",
                    "additionalProperties": {
                        "$ref": "https://api.swaggerhub.com/domains/Plattform_i40/Part2-API-Schemas/V3.0.1#/components/schemas/SubmodelDescriptor"
                    }
                }
            }
        },
        "expectedReturnValue": {
            "type": "object"
        },
        "expectedErrorStatusCode": {
            "type": "integer",
            "pattern": "^(4|5)\\d{2}$"
        }
    },
    "oneOf": [
        {
            "required": ["expectedReturnValue"]
        },
        {
            "required": ["expectedErrorStatusCode"]
        }
    ],
    "required": ["expectedState"]
}
