{
    "name": "attachment-not-found (404)",
    "initialState": {
            "submodels": [
                {
                    "modelType": "Submodel",
                    "kind": "Instance",
                    "id": "http://sm.twinficient.de/TechnicalData/heater-definition/Optima_Plus_30",
                    "idShort": "TechnicalData-heater-definition/Optima_Plus_30",
                    "submodelElements": []
                },
                {
                    "modelType": "Submodel",
                    "kind": "Instance",
                    "id": "http://sm.twinficient.de/TechnicalData/heater-definition/Optima_Plus_40",
                    "idShort": "TechnicalData-heater-definition/Optima_Plus_40",
                    "submodelElements":  [ 
                        {
                            "modelType" : "File",
                            "idShort" : "BasyxImage",
                            "value" : "basyx_thumbnail.png",
                            "contentType": "image/png"
                        }
                    ]
                }
            ],
            "fileAttachments" : {
            }
    },
    "invocation": {
        "args": {
            "submodelIdentifier": "http://sm.twinficient.de/TechnicalData/heater-definition/Optima_Plus_40",
            "idShortPath": "BasyxImage"
        }
    },
    "expectedState": {
        "submodels": [
            {
                "modelType": "Submodel",
                "kind": "Instance",
                "id": "http://sm.twinficient.de/TechnicalData/heater-definition/Optima_Plus_30",
                "idShort": "TechnicalData-heater-definition/Optima_Plus_30",
                "submodelElements": []
            },
            {
                "modelType": "Submodel",
                "kind": "Instance",
                "id": "http://sm.twinficient.de/TechnicalData/heater-definition/Optima_Plus_40",
                "idShort": "TechnicalData-heater-definition/Optima_Plus_40",
                "submodelElements":  [ 
                    {
                        "modelType" : "File",
                        "idShort" : "BasyxImage",
                        "value" : "basyx_thumbnail.png",
                        "contentType": "image/png"
                    }
                ]
            }
        ],
        "fileAttachments" : {
        }
    },
    "expectedErrorStatusCode" : 404
}