{
    "name": "conflict-test 409",
    "initialState": {
        "shells": [
            {
                "modelType": "AssetAdministrationShell",
                "assetInformation": {
                    "assetKind": "Instance",
                    "globalAssetId": "https://acplt.org/Test_Asset"
                },
                "derivedFrom": {
                    "keys": [
                        {
                            "type": "AssetAdministrationShell",
                            "value": "https://acplt.org/TestAssetAdministrationShell2"
                        }
                    ],
                    "type": "ExternalReference"
                },
                "submodels": [
                    {
                        "keys": [
                            {
                                "type": "Submodel",
                                "value": "https://acplt.org/Test_Submodel"
                            }
                        ],
                        "type": "ExternalReference"
                    },
                    {
                        "keys": [
                            {
                                "type": "Submodel",
                                "value": "http://acplt.org/Submodels/Assets/TestAsset/BillOfMaterial"
                            }
                        ],
                        "type": "ExternalReference"
                    },
                    {
                        "keys": [
                            {
                                "type": "Submodel",
                                "value": "http://acplt.org/Submodels/Assets/TestAsset/Identification"
                            }
                        ],
                        "type": "ExternalReference"
                    }
                ],
                "administration": {
                    "revision": "9",
                    "version": "0"
                },
                "id": "https://acplt.org/Test_AssetAdministrationShell",
                "description": [
                    {
                        "language": "en-us",
                        "text": "An Example Asset Administration Shell for the test application"
                    },
                    {
                        "language": "de",
                        "text": "Ein Beispiel-Verwaltungsschale für eine Test-Anwendung"
                    }
                ],
                "idShort": "TestAssetAdministrationShell"
            }
        ],
        "submodels": []
    },
    "invocation": {
        "args": {
            "assetAdministrationShell" :             {
                "modelType": "AssetAdministrationShell",
                "assetInformation": {
                    "assetKind": "Instance",
                    "globalAssetId": "https://acplt.org/Test_Asset"
                },
                "derivedFrom": {
                    "keys": [
                        {
                            "type": "AssetAdministrationShell",
                            "value": "https://acplt.org/TestAssetAdministrationShell2"
                        }
                    ],
                    "type": "ExternalReference"
                },
                "submodels": [
                    {
                        "keys": [
                            {
                                "type": "Submodel",
                                "value": "https://acplt.org/Test_Submodel"
                            }
                        ],
                        "type": "ExternalReference"
                    },
                    {
                        "keys": [
                            {
                                "type": "Submodel",
                                "value": "http://acplt.org/Submodels/Assets/TestAsset/BillOfMaterial"
                            }
                        ],
                        "type": "ExternalReference"
                    },
                    {
                        "keys": [
                            {
                                "type": "Submodel",
                                "value": "http://acplt.org/Submodels/Assets/TestAsset/Identification"
                            }
                        ],
                        "type": "ExternalReference"
                    }
                ],
                "administration": {
                    "revision": "10",
                    "version": "0"
                },
                "id": "https://acplt.org/Test_AssetAdministrationShell",
                "idShort": "ToUpdate"
            }
        }
    },
    "expectedState": {
        "shells": [
            {
                "modelType": "AssetAdministrationShell",
                "assetInformation": {
                    "assetKind": "Instance",
                    "globalAssetId": "https://acplt.org/Test_Asset"
                },
                "derivedFrom": {
                    "keys": [
                        {
                            "type": "AssetAdministrationShell",
                            "value": "https://acplt.org/TestAssetAdministrationShell2"
                        }
                    ],
                    "type": "ExternalReference"
                },
                "submodels": [
                    {
                        "keys": [
                            {
                                "type": "Submodel",
                                "value": "https://acplt.org/Test_Submodel"
                            }
                        ],
                        "type": "ExternalReference"
                    },
                    {
                        "keys": [
                            {
                                "type": "Submodel",
                                "value": "http://acplt.org/Submodels/Assets/TestAsset/BillOfMaterial"
                            }
                        ],
                        "type": "ExternalReference"
                    },
                    {
                        "keys": [
                            {
                                "type": "Submodel",
                                "value": "http://acplt.org/Submodels/Assets/TestAsset/Identification"
                            }
                        ],
                        "type": "ExternalReference"
                    }
                ],
                "administration": {
                    "revision": "9",
                    "version": "0"
                },
                "id": "https://acplt.org/Test_AssetAdministrationShell",
                "description": [
                    {
                        "language": "en-us",
                        "text": "An Example Asset Administration Shell for the test application"
                    },
                    {
                        "language": "de",
                        "text": "Ein Beispiel-Verwaltungsschale für eine Test-Anwendung"
                    }
                ],
                "idShort": "TestAssetAdministrationShell"
            }
        ],
        "submodels": []
    },
    "expectedErrorStatusCode": 409
}