{
    "name": "not-found-test (404)",
    "initialState": {
        "submodels": [
            {
                "modelType": "Submodel",
                "kind": "Instance",
                "id": "http://sm.twinficient.de/TechnicalData/heater-definition/Optima_Plus_30",
                "idShort": "TechnicalData-heater-definition/Optima_Plus_30",
                "submodelElements": []
            },
            {
                "modelType": "Submodel",
                "kind": "Instance",
                "id": "http://sm.twinficient.de/TechnicalData/heater-definition/Optima_Plus_40",
                "idShort": "TechnicalData-heater-definition/Optima_Plus_40",
                "submodelElements": []
            },
            {
                "modelType": "Submodel",
                "kind": "Instance",
                "id": "http://sm.twinficient.de/TechnicalData/heater-definition/Optima_Plus_40_Erdgas",
                "idShort": "TechnicalData-heater-definition/Optima_Plus_40_Erdgas",
                "submodelElements": []
            }
        ]
    },
    "invocation": {
        "args": {
            "submodelIdentifier": "https://admin-shell.io/idta/TimeSeries/1/1_2"
        }
    },
    "expectedState": {
        "submodels": [
            {
                "modelType": "Submodel",
                "kind": "Instance",
                "id": "http://sm.twinficient.de/TechnicalData/heater-definition/Optima_Plus_30",
                "idShort": "TechnicalData-heater-definition/Optima_Plus_30",
                "submodelElements": []
            },
            {
                "modelType": "Submodel",
                "kind": "Instance",
                "id": "http://sm.twinficient.de/TechnicalData/heater-definition/Optima_Plus_40",
                "idShort": "TechnicalData-heater-definition/Optima_Plus_40",
                "submodelElements": []
            },
            {
                "modelType": "Submodel",
                "kind": "Instance",
                "id": "http://sm.twinficient.de/TechnicalData/heater-definition/Optima_Plus_40_Erdgas",
                "idShort": "TechnicalData-heater-definition/Optima_Plus_40_Erdgas",
                "submodelElements": []
            }
        ]
    },
    "expectedErrorStatusCode": 404
}