{
    "name": "path-not-found-test (404)",
    "initialState": {
        "submodels": [
            {
                "modelType": "Submodel",
                "kind": "Instance",
                "id": "http://sm.twinficient.de/TechnicalData/heater-definition/Optima_Plus_30",
                "idShort": "TechnicalData-heater-definition/Optima_Plus_30",
                "submodelElements": []
            },
            {
                "modelType": "Submodel",
                "kind": "Instance",
                "id": "http://sm.twinficient.de/TechnicalData/heater-definition/Optima_Plus_40",
                "idShort": "TechnicalData-heater-definition/Optima_Plus_40",
                "submodelElements": {
                    "modelType": "SubmodelElementCollection",
                    "idShort": "col1",
                    "value": [
                        {
                            "modelType": "SubmodelElementCollection",
                            "idShort": "inner",
                            "value": []
                        }
                    ]
                }
            }
        ]
    },
    "invocation": {
        "args": {
            "submodelIdentifier": "http://sm.twinficient.de/TechnicalData/heater-definition/Optima_Plus_40",
            "idShortPath": "col1.unknown",
            "submodelElement": {
                "modelType": "Property",
                "value": "12",
                "valueType": "xs:integer",
                "idShort": "inner"
            }
        }
    },
    "expectedState": {
        "submodels": [
            {
                "modelType": "Submodel",
                "kind": "Instance",
                "id": "http://sm.twinficient.de/TechnicalData/heater-definition/Optima_Plus_30",
                "idShort": "TechnicalData-heater-definition/Optima_Plus_30",
                "submodelElements": []
            },
            {
                "modelType": "Submodel",
                "kind": "Instance",
                "id": "http://sm.twinficient.de/TechnicalData/heater-definition/Optima_Plus_40",
                "idShort": "TechnicalData-heater-definition/Optima_Plus_40",
                "submodelElements": {
                    "modelType": "SubmodelElementCollection",
                    "idShort": "col1",
                    "value": [
                        {
                            "modelType": "SubmodelElementCollection",
                            "idShort": "inner",
                            "value": []
                        }
                    ]
                }
            }
        ]
    },
    "expectedErrorStatusCode" : 404
}