{
    "name": "success-test",
    "initialState": {
        "submodels": [
            {
                "modelType": "Submodel",
                "kind": "Instance",
                "id": "http://sm.twinficient.de/TechnicalData/heater-definition/Optima_Plus_30",
                "idShort": "TechnicalData-heater-definition/Optima_Plus_30",
                "submodelElements": []
            },
            {
                "modelType": "Submodel",
                "kind": "Instance",
                "id": "http://sm.twinficient.de/TechnicalData/heater-definition/Optima_Plus_40",
                "idShort": "TechnicalData-heater-definition/Optima_Plus_40",
                "submodelElements": {
                    "modelType": "SubmodelElementCollection",
                    "idShort": "col1",
                    "value": [
                        {
                            "modelType": "SubmodelElementCollection",
                            "idShort": "col2"
                        }
                    ]
                }
            }
        ]
    },
    "invocation": {
        "args": {
            "submodelIdentifier": "http://sm.twinficient.de/TechnicalData/heater-definition/Optima_Plus_40",
            "idShortPath": "col1.col2",
            "submodelElement": {
                "modelType": "Property",
                "value": "12",
                "valueType": "xs:integer",
                "idShort": "prop1"
            }
        }
    },
    "expectedState": {
        "submodels": [
            {
                "modelType": "Submodel",
                "kind": "Instance",
                "id": "http://sm.twinficient.de/TechnicalData/heater-definition/Optima_Plus_30",
                "idShort": "TechnicalData-heater-definition/Optima_Plus_30",
                "submodelElements": []
            },
            {
                "modelType": "Submodel",
                "kind": "Instance",
                "id": "http://sm.twinficient.de/TechnicalData/heater-definition/Optima_Plus_40",
                "idShort": "TechnicalData-heater-definition/Optima_Plus_40",
                "submodelElements": {
                    "modelType": "SubmodelElementCollection",
                    "idShort": "col1",
                    "value": [
                        {
                            "modelType": "SubmodelElementCollection",
                            "idShort": "col2",
                            "value": [
                                {
                                    "modelType": "Property",
                                    "value": "12",
                                    "valueType": "xs:integer",
                                    "idShort": "prop1"
                                }
                            ]
                        }
                    ]
                }
            }
        ]
    },
    "expectedReturnValue": {
        "modelType": "Property",
        "value": "12",
        "valueType": "xs:integer",
        "idShort": "Prop1"
    }
}