{
    "name": "filtered-test",
    "initialState": {
        "assetLinks": {
            "https://acplt.org/Test_AssetAdministrationShell1": [
                {
                    "name": "specificAssetId",
                    "value": "org::acplt::asset::test1"
                },
                {
                    "name": "type",
                    "value": "robot"
                }
            ],
            "https://acplt.org/Test_AssetAdministrationShell2": [
                {
                    "name": "specificAssetId",
                    "value": "org::acplt::asset::test2"
                },
                {
                    "name": "type",
                    "value": "heater"
                }
            ],
            "https://acplt.org/Test_AssetAdministrationShell3": [
                {
                    "name": "specificAssetId",
                    "value": "org::acplt::asset::test3"
                },
                {
                    "name": "type",
                    "value": "robot"
                }
            ]
        }
    },
    "invocation": {
        "args": {
            "assetIds": [
                {
                    "name": "type",
                    "value": "robot"
                }
            ]
        }
    },
    "expectedState": {
        "assetLinks": {
            "https://acplt.org/Test_AssetAdministrationShell1": [
                {
                    "name": "specificAssetId",
                    "value": "org::acplt::asset::test1"
                },
                {
                    "name": "type",
                    "value": "robot"
                }
            ],
            "https://acplt.org/Test_AssetAdministrationShell2": [
                {
                    "name": "specificAssetId",
                    "value": "org::acplt::asset::test2"
                },
                {
                    "name": "type",
                    "value": "heater"
                }
            ],
            "https://acplt.org/Test_AssetAdministrationShell3": [
                {
                    "name": "specificAssetId",
                    "value": "org::acplt::asset::test3"
                },
                {
                    "name": "type",
                    "value": "robot"
                }
            ]
        }
    },
    "expectedReturnValue": {
        "paging_metadata": {},
        "result": [
            "https://acplt.org/Test_AssetAdministrationShell1",
            "https://acplt.org/Test_AssetAdministrationShell3"
        ]
    }
}