{
    "name": "empty-test",
    "initialState": {
        "shells": [],
        "submodels": []
    },
    "invocation": {
        "args": {}
    },
    "expectedState": {
        "shells": [],
        "submodels": []
    },
    "expectedReturnValue": {
        "paging_metadata": {},
        "result": []
    }
}